{
  "schema_version": "v1.0",
  "session": {
    "id": "doc-test",
    "level": "L1_BASE",
    "created_at": "2026-07-05T05:39:18.012857+00:00",
    "updated_at": "2026-07-05T05:39:18.058436+00:00"
  },
  "status": "archived",
  "stats": {
    "done": 2,
    "total": 2,
    "tick": 0
  },
  "steps": [
    {
      "id": "S1",
      "status": "completed"
    },
    {
      "id": "S2",
      "status": "completed"
    }
  ]
}
