{
  "schema_version": "v1.0",
  "session": {
    "id": "REFACTOR-REFDOCS",
    "level": "L1_BASE",
    "created_at": "2026-07-05T09:02:43.946302+00:00",
    "updated_at": "2026-07-05T09:02:43.946324+00:00"
  },
  "status": "archived",
  "stats": {
    "done": 0,
    "total": 3,
    "tick": 0
  },
  "steps": [
    {
      "id": "S1",
      "status": "pending"
    },
    {
      "id": "S2",
      "status": "pending"
    },
    {
      "id": "S3",
      "status": "pending"
    }
  ]
}
