{
  "schema_version": "v1.0",
  "session": {
    "id": "handoff-test",
    "level": "L1_BASE",
    "created_at": "2026-07-05T05:44:46.707881+00:00",
    "updated_at": "2026-07-05T09:07:15.435947+00:00"
  },
  "status": "archived",
  "stats": {
    "done": 1,
    "total": 1,
    "tick": 0
  },
  "steps": [
    {
      "id": "S1",
      "status": "completed"
    }
  ]
}
