{
  "schema_version": "v1.0",
  "session": {
    "id": "VERIFY-FIX",
    "level": "L1_BASE",
    "created_at": "2026-07-05T09:08:36.579219+00:00",
    "updated_at": "2026-07-05T09:08:36.579238+00:00"
  },
  "status": "archived",
  "stats": {
    "done": 0,
    "total": 2,
    "tick": 0
  },
  "steps": [
    {
      "id": "A1",
      "status": "pending"
    },
    {
      "id": "A2",
      "status": "pending"
    }
  ]
}
