{
  "schema_version": "v1.0",
  "session": {
    "id": "full-test",
    "level": "L1_BASE",
    "created_at": "2026-07-05T05:39:26.615836+00:00",
    "updated_at": "2026-07-05T05:39:26.660201+00:00"
  },
  "status": "archived",
  "stats": {
    "done": 1,
    "total": 1,
    "tick": 0
  },
  "steps": [
    {
      "id": "S1",
      "status": "completed"
    }
  ],
  "archived_at": "2026-07-05T05:39:26.660193+00:00"
}
