{
  "schema_version": "v1.0",
  "session": {
    "id": "CLEAN-TEST",
    "level": "L1_BASE",
    "created_at": "2026-07-05T09:09:04.991045+00:00",
    "updated_at": "2026-07-05T09:09:16.639691+00:00"
  },
  "status": "archived",
  "stats": {
    "done": 3,
    "total": 3,
    "tick": 0
  },
  "steps": [
    {
      "id": "C1",
      "status": "completed"
    },
    {
      "id": "C2",
      "status": "completed"
    },
    {
      "id": "C3",
      "status": "completed"
    }
  ],
  "archived_at": "2026-07-05T09:09:16.639682+00:00"
}
